{
  "$schema": "./proposal-disposition-record-v1.schema.json",
  "schema_version": "1.0.0",
  "artifact_type": "P0_PROPOSAL_DISPOSITION_RECORD",
  "artifact_id": "INTERP-DIALOGUE-001P0-V1-PROPOSAL-DISPOSITIONS",
  "authority": "LINEAGE_SUMMARY_ONLY_NO_PROPOSAL_LEVEL_DECISION_ENUM",
  "proposal_dispositions": [
    {
      "source_proposal_id": "RP-001",
      "resolution_candidate_decision_refs": [
        "DEC-RP001-REL",
        "DEC-RP001-WORK",
        "DEC-RP001-RISK"
      ],
      "accepted_resolution_candidate_ids": [
        "RC-RP001-REL",
        "RC-RP001-WORK",
        "RC-RP001-RISK"
      ],
      "rejected_resolution_candidate_ids": [],
      "deferred_resolution_candidate_ids": [],
      "coverage_status": "COVERED_BY_EXACT_CANDIDATE_DECISIONS"
    },
    {
      "source_proposal_id": "RP-002",
      "resolution_candidate_decision_refs": [
        "DEC-RP002-PARTNER"
      ],
      "accepted_resolution_candidate_ids": [
        "RC-RP002-PARTNER"
      ],
      "rejected_resolution_candidate_ids": [],
      "deferred_resolution_candidate_ids": [],
      "coverage_status": "COVERED_BY_EXACT_CANDIDATE_DECISIONS"
    },
    {
      "source_proposal_id": "RP-003",
      "resolution_candidate_decision_refs": [
        "DEC-RP003-SMALL-CARE",
        "DEC-RP003-DISTANCE"
      ],
      "accepted_resolution_candidate_ids": [
        "RC-RP003-SMALL-CARE",
        "RC-RP003-DISTANCE"
      ],
      "rejected_resolution_candidate_ids": [],
      "deferred_resolution_candidate_ids": [],
      "coverage_status": "COVERED_BY_EXACT_CANDIDATE_DECISIONS"
    },
    {
      "source_proposal_id": "RP-004",
      "resolution_candidate_decision_refs": [
        "DEC-RP004-NO-INCIDENT"
      ],
      "accepted_resolution_candidate_ids": [
        "RC-RP004-NO-INCIDENT"
      ],
      "rejected_resolution_candidate_ids": [],
      "deferred_resolution_candidate_ids": [],
      "coverage_status": "COVERED_BY_EXACT_CANDIDATE_DECISIONS"
    },
    {
      "source_proposal_id": "RP-005",
      "resolution_candidate_decision_refs": [
        "DEC-RP005-ORDINARY",
        "DEC-RP005-LOW"
      ],
      "accepted_resolution_candidate_ids": [
        "RC-RP005-ORDINARY",
        "RC-RP005-LOW"
      ],
      "rejected_resolution_candidate_ids": [],
      "deferred_resolution_candidate_ids": [],
      "coverage_status": "COVERED_BY_EXACT_CANDIDATE_DECISIONS"
    },
    {
      "source_proposal_id": "RP-006",
      "resolution_candidate_decision_refs": [
        "DEC-RP006-REL-ORDINARY",
        "DEC-RP006-REL-LOW",
        "DEC-RP006-WORK-LOW",
        "DEC-RP006-WORK-HIGH",
        "DEC-RP006-RISK-LOW",
        "DEC-RP006-RISK-HIGH"
      ],
      "accepted_resolution_candidate_ids": [
        "RC-RP006-REL-ORDINARY",
        "RC-RP006-REL-LOW",
        "RC-RP006-WORK-LOW",
        "RC-RP006-WORK-HIGH",
        "RC-RP006-RISK-LOW",
        "RC-RP006-RISK-HIGH"
      ],
      "rejected_resolution_candidate_ids": [],
      "deferred_resolution_candidate_ids": [],
      "coverage_status": "COVERED_BY_EXACT_CANDIDATE_DECISIONS"
    },
    {
      "source_proposal_id": "RP-007",
      "resolution_candidate_decision_refs": [
        "DEC-RP007-PRESENTATION",
        "DEC-RP007-FOLLOWING"
      ],
      "accepted_resolution_candidate_ids": [
        "RC-RP007-PRESENTATION",
        "RC-RP007-FOLLOWING"
      ],
      "rejected_resolution_candidate_ids": [],
      "deferred_resolution_candidate_ids": [],
      "coverage_status": "COVERED_BY_EXACT_CANDIDATE_DECISIONS"
    },
    {
      "source_proposal_id": "RP-008",
      "resolution_candidate_decision_refs": [
        "DEC-RP008-MAPPING-LINEAGE"
      ],
      "accepted_resolution_candidate_ids": [
        "RC-RP008-MAPPING-LINEAGE"
      ],
      "rejected_resolution_candidate_ids": [],
      "deferred_resolution_candidate_ids": [],
      "coverage_status": "COVERED_BY_EXACT_CANDIDATE_DECISIONS"
    }
  ]
}
